date,precipitation,temp_max,temp_min,wind,weather,full_dict,day_summary
2012-01-01,0.0,12.8,5.0,4.7,drizzle,"{'date': Timestamp('2012-01-01 00:00:00'), 'precipitation': 0.0, 'temp_max': 12.8, 'temp_min': 5.0, 'wind': 4.7, 'weather': 'drizzle', 'full_dict': {'date': Timestamp('2012-01-01 00:00:00'), 'precipitation': 0.0, 'temp_max': 12.8, 'temp_min': 5.0, 'wind': 4.7, 'weather': 'drizzle'}}","On January 1, 2012, the weather conditions were characterized by a light drizzle, although there was no recorded precipitation for the day. The maximum temperature reached 12.8°C, while the minimum temperature dropped to 5.0°C. Wind speeds were moderate at 4.7 km/h, contributing to a cool and damp atmosphere. Overall, the day was marked by mild temperatures and overcast skies, typical of a drizzly winter day."
2012-01-02,10.9,10.6,2.8,4.5,rain,"{'date': Timestamp('2012-01-02 00:00:00'), 'precipitation': 10.9, 'temp_max': 10.6, 'temp_min': 2.8, 'wind': 4.5, 'weather': 'rain', 'full_dict': {'date': Timestamp('2012-01-02 00:00:00'), 'precipitation': 10.9, 'temp_max': 10.6, 'temp_min': 2.8, 'wind': 4.5, 'weather': 'rain'}}","On January 2, 2012, the weather was characterized by significant rainfall, recording a precipitation level of 10.9 mm. The temperature fluctuated between a maximum of 10.6°C and a minimum of 2.8°C, indicating a cool day overall. Wind conditions were relatively calm, with wind speeds reaching up to 4.5 km/h. Overall, the day's weather was dominated by rainy conditions, contributing to a wet and cool atmosphere."
2012-01-03,0.8,11.7,7.2,2.3,rain,"{'date': Timestamp('2012-01-03 00:00:00'), 'precipitation': 0.8, 'temp_max': 11.7, 'temp_min': 7.2, 'wind': 2.3, 'weather': 'rain', 'full_dict': {'date': Timestamp('2012-01-03 00:00:00'), 'precipitation': 0.8, 'temp_max': 11.7, 'temp_min': 7.2, 'wind': 2.3, 'weather': 'rain'}}","On January 3, 2012, the weather was characterized by rainy conditions, with a recorded precipitation of 0.8 mm. The maximum temperature reached 11.7°C, while the minimum temperature dipped to 7.2°C, indicating a mild day overall. Wind speeds were moderate at 2.3 km/h, contributing to the overall damp atmosphere. The combination of these factors created a cool and wet day, typical of rainy weather."
2012-01-04,20.3,12.2,5.6,4.7,rain,"{'date': Timestamp('2012-01-04 00:00:00'), 'precipitation': 20.3, 'temp_max': 12.2, 'temp_min': 5.6, 'wind': 4.7, 'weather': 'rain', 'full_dict': {'date': Timestamp('2012-01-04 00:00:00'), 'precipitation': 20.3, 'temp_max': 12.2, 'temp_min': 5.6, 'wind': 4.7, 'weather': 'rain'}}","On January 4, 2012, the weather was marked by significant rain, with a total precipitation of 20.3 mm. The maximum temperature reached 12.2°C, while the minimum temperature dropped to 5.6°C, indicating a cool day overall. Wind speeds were moderate at 4.7 m/s, further contributing to the day's chilly atmosphere. The combination of rain and cooler temperatures rendered it a typical wet winter day."
2012-01-05,1.3,8.9,2.8,6.1,rain,"{'date': Timestamp('2012-01-05 00:00:00'), 'precipitation': 1.3, 'temp_max': 8.9, 'temp_min': 2.8, 'wind': 6.1, 'weather': 'rain', 'full_dict': {'date': Timestamp('2012-01-05 00:00:00'), 'precipitation': 1.3, 'temp_max': 8.9, 'temp_min': 2.8, 'wind': 6.1, 'weather': 'rain'}}","On January 5, 2012, the weather was characterized by rainfall, with a total precipitation measurement of 1.3 mm. The temperature fluctuated between a minimum of 2.8°C and a maximum of 8.9°C, indicating a relatively cool day. Wind conditions were moderate, reaching speeds of 6.1 km/h. Overall, the day was marked by damp and chilly weather typical of winter, as reflected in the rainy conditions."
